Sheet: data
A1: id | B1: template | C1: date | D1: modelLife | E1: vehicleLife | F1: costFactor | G1: runningCostFactor | H1: speed | I1: power | J1: weight | K1: tec | L1: engine | M1: gauge | N1: service | O1: length | P1: imageFile | Q1: animationFrames | R1: tenderLength | S1: effect | T1: info
A2: 111_mataro | B2: template | C2: date(1848,01,01) | D2: 20 | E2: 50 | F2: 6 | G2: 30 | H2: 86 km/h | I2: 250 hpM | J2: 24 ton | K2: of:=22/(9.8*23.2) -> 0.0967628430682618 | L2: steam | M2: iberian | N2: p | O2: 4 | P2: mataro/mataro | Q2: 4 | R2: 2 | S2: -3 | T2: 0
A3: 120_norte100 | B3: template | C3: date(1858,01,01) | D3: 50 | E3: 80 | F3: 7 | G3: 60 | H3: 80 km/h | I3: 300 hpM | J3: 30 ton | K3: 0.09 | L3: steam | M3: iberian | N3: p | O3: 4 | P3: mataro/mataro | Q3: 4 | R3: 2 | S3: -3 | T3: 0
A4: 030_norte300 | B4: template | C4: date(1860,01,01) | D4: 50 | E4: 80 | F4: 7 | G4: 60 | H4: 50 km/h | I4: 400 hpM | J4: 30 ton | K4: 0.092 | L4: steam | M4: iberian | N4: f | O4: 4 | P4: mataro/mataro | Q4: 4 | R4: 2 | S4: -3 | T4: 0
A5: 040_norte500 | B5: template | C5: date(1864,01,01) | D5: 50 | E5: 80 | F5: 7 | G5: 55 | H5: 50 km/h | I5: 450 hpM | J5: 30 ton | K5: 0.1 | L5: steam | M5: iberian | N5: hf | O5: 6 | P5: perruca/perruca | Q5: 4 | R5: 3 | S5: -3 | T5: 0
A6: 220T_estrecha | B6: template | C6: date(1874,01,01) | D6: 50 | E6: 80 | F6: 6 | G6: 50 | H6: 50 km/h | I6: 400 hpM | J6: 20 ton | K6: 0.09 | L6: steam | M6: narrow | N6: cp | O6: 6 | P6: perruca/perruca | Q6: 4 | R6: 0 | S6: -3 | T6: 0
A7: 030T_estrecha | B7: template | C7: date(1880,01,01) | D7: 50 | E7: 75 | F7: 6 | G7: 40 | H7: 50 km/h | I7: 400 hpM | J7: 25 ton | K7: 0.095 | L7: steam | M7: narrow | N7: na | O7: 6 | P7: perruca/perruca | Q7: 4 | R7: 0 | S7: -3 | T7: 0
A8: 030T_caldas | B8: template | C8: date(1887,01,01) | D8: 50 | E8: 75 | F8: 7 | G8: 40 | H8: 50 km/h | I8: 430 hpM | J8: 29.3 ton | K8: 0.092 | L8: steam | M8: iberian | N8: cp | O8: 6 | P8: perruca/perruca | Q8: 4 | R8: 0 | S8: -3 | T8: 0
A9: 030_perruca | B9: template | C9: date(1880,01,01) | D9: 50 | E9: 100 | F9: of:=(16406/234374)*100 -> 6.99992319967232 | G9: of:=(1640/3280)*100 -> 50 | H9: 80 km/h | I9: 422 hpM | J9: 64.77 ton | K9: 0.09261223008 | L9: steam | M9: iberian | N9: na | O9: 6 | P9: perruca/perruca | Q9: 4 | R9: 3 | S9: -3 | T9: 0
A10: 040_verraco | B10: template | C10: date(1864,01,01) | D10: 50 | E10: 102 | F10: of:=(18750/234374)*100 -> 8.00003413347897 | G10: of:=(2132/3280)*100 -> 65 | H10: 80 km/h | I10: 675 hpM | J10: 73.9 ton | K10: 0.117908162888 | L10: steam | M10: iberian | N10: na | O10: 7 | P10: Verraco/Verraco | Q10: 4 | R10: 3 | S10: -3 | T10: 0
A11: 140_estrecha_consolidacion | B11: template | C11: date(1898,01,01) | D11: 45 | E11: 40 | F11: 7 | G11: 60 | H11: 80 km/h | I11: 1000 hpM | J11: 70 ton | K11: 0.28 | L11: steam | M11: narrow | N11: na | O11: 8 | P11: Consolidacion/Consolidacion | Q11: 4 | R11: 3 | S11: -3 | T11: 0
A12: 141_mikado | B12: template | C12: date(1917,01,01) | D12: 45 | E12: 50 | F12: of:=(53906/234374)*100 -> 22.9999914666303 | G12: of:=(4112/3280)*100 -> 125.365853658537 | H12: 115 km/h | I12: 2028 hpM | J12: 150 ton | K12: 0.29659183665758 | L12: steam | M12: iberian | N12: na | O12: 9 | P12: mikado/mikado | Q12: 4 | R12: 6 | S12: -3 | T12: 0
A13: 140_consolidacion | B13: template | C13: date(1920,01,01) | D13: 45 | E13: 50 | F13: of:=(23436/234374)*100 -> 9.99940266411803 | G13: of:=(2952/3280)*100 -> 90 | H13: 90 km/h | I13: 1373 hpM | J13: 80 ton | K13: 0.29676530604529 | L13: steam | M13: iberian | N13: na | O13: 8 | P13: Consolidacion/Consolidacion | Q13: 4 | R13: 3 | S13: -3 | T13: 0
A14: 240_mastodonte | B14: template | C14: date(1932,01,01) | D14: 45 | E14: 50 | F14: of:=(35156/234374)*100 -> 14.9999573331513 | G14: of:=(4264/3280)*100 -> 130 | H14: 105 km/h | I14: 2042 hpM | J14: 90 ton | K14: 0.2966326529841 | L14: steam | M14: iberian | N14: na | O14: 9 | P14: mastodonte/mastodonte | Q14: 4 | R14: 4 | S14: -3 | T14: 0
A15: 282_garrafeta | B15: garrafeta | C15: date(1931,01,01) | D15: 45 | E15: 50 | F15: of:=(44530/234374)*100 -> 18.9995477314037 | G15: of:=(4756/3280)*100 -> 145 | H15: 60 km/h | I15: 1825 hpM | J15: 170 ton | K15: 0.12844897955844 | L15: steam | M15: iberian | N15: hf | O15: 7 | P15: garrafeta/garrafeta | Q15: 4 | R15: 3 | S15: -3 | T15: 0
A16: 241_montanya | B16: template | C16: date(1927,01,01) | D16: 45 | E16: 50 | F16: of:=(38812/234374)*100 -> 16.5598573220579 | G16: of:=(2362/3280)*100 -> 72.0121951219512 | H16: 120 km/h | I16: 2232 hpM | J16: 180 ton | K16: 0.29647959175965 | L16: steam | M16: iberian | N16: ephf | O16: 9 | P16: montanya/montanya | Q16: 4 | R16: 6 | S16: -3 | T16: 0
A17: 231_pacific | B17: template | C17: date(1928,01,01) | D17: 45 | E17: 50 | F17: of:=(32812/234374)*100 -> 13.9998463993446 | G17: of:=(2296/3280)*100 -> 70 | H17: 125 km/h | I17: 2079 hpM | J17: 130 ton | K17: 0.29669387747388 | L17: steam | M17: iberian | N17: eplf | O17: 8 | P17: pacific/pacific | Q17: 4 | R17: 4 | S17: -3 | T17: 0
A18: 151_santafe | B18: template | C18: date(1942,01,01) | D18: 45 | E18: 50 | F18: of:=(42186/234374)*100 -> 17.999436797597 | G18: of:=(4592/3280)*100 -> 140 | H18: 100 km/h | I18: 4113 hpM | J18: 213 ton | K18: 0.29654081624943 | L18: steam | M18: iberian | N18: hf | O18: 9 | P18: santafe/santafe | Q18: 4 | R18: 4 | S18: -3 | T18: 0
A19: 242_confederacion | B19: template | C19: date(1956,01,01) | D19: 45 | E19: 30 | F19: of:=(46874/234374)*100 -> 19.9996586652103 | G19: of:=(5788/3280)*100 -> 176.463414634146 | H19: 125 km/h | I19: 4563 hpM | J19: 213 ton | K19: 0.09923469385175 | L19: steam | M19: iberian | N19: ephf | O19: 9 | P19: confederacion/confederacion | Q19: 4 | R19: 6 | S19: -3 | T19: 0

Sheet: Infor
A1: id | B1: Identificador de NML de la locomotora/maquina
A2: template | B2: Plantilla a usar
A3: date | B3: Fecha de introducción del modelo en formato NML : date(YYYY,MM,DD) (cuidado que el Libreoffice tiene a poner la “D” en mayusculas
A4: modelLife | B4: Tiempo en años que el modelo se puede comprar
A5: vehicleLife | B5: Vida de una maquina comprada
A6: costFactor | B6: Factor de coste de compra respecto al precio base de una maquina de vapor
A7: runningCostFactor | B7: Factor de coste de funcionamiento respecto al precio base de una maquina de vapor
A8: speed | B8: Velocidad en formato NML, por ejemplo 90 km/h
A9: power | B9: Potencia de la maquina en formato NML. “hpM” son caballos de vapor o “cv” que usamos aquí
A10: weight | B10: Peso de la maquina en formato NML, por ejemplo “80 ton”
A11: tec | B11: Factor de esfuerzo de tracción. Se usa para calcular el esfuerzo de tracción maximo de la maquina. Corresponde a la fracción (0..1) del peso de la maquina que está disponible como esfuerzo de tracción. Se puede calcular de la siguiente forma : Tec = Te en KNewtons / (9.8 * Peso en Toneladas)
A12: gauge | B12: Track gauge : iberian, standard (aka Spanish high speed tracks), narrow
A13: service | B13: Type of service : p->passengers, ep->express passengers, hp->high speed passengers, f->freight, lf->light freight, hf->heavy freight, ephf->express passengers or heavy freight, hphf->high speed passengers or heavy freig, eplf->express passengers or light freight, fp->freight or passengers, lfep->light freight or express passengers
A14: length | B14: Longitud de la maquina (de 1 a 8). Una unidad representa 4 pixeles de un sprite clasico en la diagonal horizontal (ver gfx/TTD sizes.png)
A15: imageFile | B15: Ruta dentro de la carpeta “gfx” al fichero de imagen con los sprites
A16: animationFrames | B16: N.º de frames de animación de la locomotora. Usualmente son 4 o 6 si hay alguna animación
A17: tenderLength | B17: Longitud del tender (de 1 a 8)
A18: effect | B18: Posicion del efecto (vapor, humo y chispas). Rango de valores: [-8,7]
D26: Tec = Te en KNewtons / (9.8 * Peso en Toneladas)
D27: Tec = Te en Kgr / Peso en Toneladas
A29: Coste base | B29: 234374 | D29: Coste real = coefiente * coste base → coeficiente = coste real / coste base
A30: Coste operación base | B30: 3280